{
  "artifactVersion": "1",
  "signalId": "breadth",
  "asOf": "2026-05-21",
  "publishedAt": "2026-05-21",
  "source": {
    "name": "StockCharts S&P 500 % Above 50-Day SMA ($SPXA50R)",
    "url": "https://stockcharts.com/freecharts/symbolsummary.html?sym=$SPXA50R",
    "note": "Manual extract: last trading-day EOD reading from StockCharts $SPXA50R (2026-05-21). Cross-checked against Barchart S&P 500 Stocks Above 50-Day Average ($S5FI) reading 56.77 on the same session — directionally consistent (both above 50%, within 0.1 pp). Not a live feed."
  },
  "seriesDefinition": "sp500_percent_above_50_day_ma",
  "updateFrequency": "daily",
  "dataQuality": "verified_manual",
  "observations": {
    "sp500Above50DayMaPercent": 56.8
  },
  "optionalObservations": {
    "sourceSymbol": "$SPXA50R",
    "sp500Above200DayMaPercent": null,
    "backupSourceName": "Barchart S&P 500 Stocks Above 50-Day Average ($S5FI)",
    "backupReadingPercent": 56.77
  }
}
